{
  "compilation_id": "example-minimal-001",
  "title": "Minimal Local Planning Experience Compilation",
  "task_title": "Create a short local planning note",
  "domain": "operations",
  "subdomain": "planning",
  "workflow_family": "structured_note_and_summary",
  "schema_version": "aa-experience-compilation-v0.2",
  "compiler_version": "aa-experience-compiler-v0.2",
  "package_version": "0.2.1",
  "created_at": "2026-07-03T00:00:00Z",
  "components": {
    "traces": true,
    "runtime_training": true,
    "training_time_package": true,
    "eval_package": true,
    "environment_replay": true,
    "source_evidence_map": true
  },
  "training_row_counts": {
    "sft": 1,
    "process_supervision": 1,
    "reward": 1,
    "verifier": 1
  }
}
